{"authority":"checked-in-source-fixture","base_contract":{"compiled_pack_path":"Content/World/Generated/GlassScar/glass_scar_compiled_map_pack_v1.json","compiled_pack_sha256":"6dbbe2f1a5bd7faec122e6050e5c2d27d4d56e3e94da357b239673ec4b6ab621"},"claim_boundary":{"compiled_fixture_is_source_data":true,"not_evidence_for":["runtime consumption of this data","mission plan sites or objective placement","spawn balance or resource pacing","measured travel time or gameplay pacing","NavMesh, formation traversal, or camera behavior","package, performance, or release readiness"],"proposed_contract":true},"grid":{"cell_count":4096,"coordinate_origin":"southwest","height_tiles":64,"index_formula":"y*width+x","width_tiles":64},"pack_format":"echoes-overlay-map-pack","pack_version":1,"schema_version":1,"source_provenance":{"runtime_mirror_commit":"6fa2d6f1355687da990b57fca6c620c3e18866c1","sources":[{"path":"Content/World/Source/GlassScar/glass_scar_overlays_v1.json","raw_sha256":"83568e4c5f93122976be65d00d7c4e2bf8d923040a8989ca7b977182743e181b"},{"path":"Content/World/Source/Skirmish/crownfall_basin_map_source_v1.json","raw_sha256":"d847dc00b15a442c6f354a94c0e206f99b2ab0aa464fe5cc49e85c60f745399c"},{"path":"Content/World/Source/Skirmish/soryn_confluence_map_source_v1.json","raw_sha256":"f51ea6762d5a4d790cabf7e75d594b4a791f45950629eb36aa8c6f31a4539d1b"}]},"variants":[{"base":"open-grid","blocked_cell_count":223,"blocked_cell_indices":[1800,1801,1802,1803,1804,1805,1806,1807,1812,1813,1814,1815,1816,1817,1818,1819,1820,1821,1827,1828,1829,1830,1831,1832,1833,1834,1835,1836,1841,1842,1843,1844,1845,1846,1847,1864,1865,1866,1867,1868,1869,1870,1871,1876,1877,1878,1879,1880,1881,1882,1883,1884,1885,1891,1892,1893,1894,1895,1896,1897,1898,1899,1900,1905,1906,1907,1908,1909,1910,1911,1928,1929,1930,1931,1932,1933,1934,1935,1940,1941,1942,1943,1944,1945,1946,1947,1948,1949,1955,1956,1957,1958,1959,1960,1961,1962,1963,1964,1969,1970,1971,1972,1973,1974,1975,2205,2206,2269,2270,2324,2325,2326,2327,2328,2329,2333,2334,2343,2344,2345,2346,2347,2348,2388,2389,2390,2391,2392,2393,2397,2398,2407,2408,2409,2410,2411,2412,2452,2453,2454,2455,2456,2457,2461,2462,2471,2472,2473,2474,2475,2476,2516,2517,2518,2519,2520,2521,2535,2536,2537,2538,2539,2540,2580,2581,2582,2583,2584,2585,2599,2600,2601,2602,2603,2604,2644,2645,2646,2647,2648,2649,2663,2664,2665,2666,2667,2668,2708,2709,2710,2711,2712,2713,2727,2728,2729,2730,2731,2732,2772,2773,2774,2775,2776,2777,2791,2792,2793,2794,2795,2796,2836,2837,2838,2839,2840,2841,2855,2856,2857,2858,2859,2860],"branch":"harvest","family":"lume-reach","id":"lume-reach-harvest","passable_cell_count":3873,"passable_component_count":1,"sites":[{"id":"local-core","passable":true,"reachable":true,"x":10,"y":10},{"id":"opponent-core","passable":true,"reachable":true,"x":54,"y":54},{"id":"future-well","passable":true,"reachable":true,"x":32,"y":32}]},{"base":"open-grid","blocked_cell_count":223,"blocked_cell_indices":[1800,1801,1802,1803,1804,1805,1806,1807,1812,1813,1814,1815,1816,1817,1818,1819,1820,1821,1827,1828,1829,1830,1831,1832,1833,1834,1835,1836,1841,1842,1843,1844,1845,1846,1847,1864,1865,1866,1867,1868,1869,1870,1871,1876,1877,1878,1879,1880,1881,1882,1883,1884,1885,1891,1892,1893,1894,1895,1896,1897,1898,1899,1900,1905,1906,1907,1908,1909,1910,1911,1928,1929,1930,1931,1932,1933,1934,1935,1940,1941,1942,1943,1944,1945,1946,1947,1948,1949,1955,1956,1957,1958,1959,1960,1961,1962,1963,1964,1969,1970,1971,1972,1973,1974,1975,2209,2210,2273,2274,2324,2325,2326,2327,2328,2329,2337,2338,2343,2344,2345,2346,2347,2348,2388,2389,2390,2391,2392,2393,2401,2402,2407,2408,2409,2410,2411,2412,2452,2453,2454,2455,2456,2457,2465,2466,2471,2472,2473,2474,2475,2476,2516,2517,2518,2519,2520,2521,2535,2536,2537,2538,2539,2540,2580,2581,2582,2583,2584,2585,2599,2600,2601,2602,2603,2604,2644,2645,2646,2647,2648,2649,2663,2664,2665,2666,2667,2668,2708,2709,2710,2711,2712,2713,2727,2728,2729,2730,2731,2732,2772,2773,2774,2775,2776,2777,2791,2792,2793,2794,2795,2796,2836,2837,2838,2839,2840,2841,2855,2856,2857,2858,2859,2860],"branch":"preserve","family":"lume-reach","id":"lume-reach-preserve","passable_cell_count":3873,"passable_component_count":1,"sites":[{"id":"local-core","passable":true,"reachable":true,"x":10,"y":10},{"id":"opponent-core","passable":true,"reachable":true,"x":54,"y":54},{"id":"future-well","passable":true,"reachable":true,"x":32,"y":32}]},{"base":"open-grid","blocked_cell_count":223,"blocked_cell_indices":[1800,1801,1802,1803,1804,1805,1806,1807,1812,1813,1814,1815,1816,1817,1818,1819,1820,1821,1827,1828,1829,1830,1831,1832,1833,1834,1835,1836,1841,1842,1843,1844,1845,1846,1847,1864,1865,1866,1867,1868,1869,1870,1871,1876,1877,1878,1879,1880,1881,1882,1883,1884,1885,1891,1892,1893,1894,1895,1896,1897,1898,1899,1900,1905,1906,1907,1908,1909,1910,1911,1928,1929,1930,1931,1932,1933,1934,1935,1940,1941,1942,1943,1944,1945,1946,1947,1948,1949,1955,1956,1957,1958,1959,1960,1961,1962,1963,1964,1969,1970,1971,1972,1973,1974,1975,2206,2207,2208,2209,2210,2270,2271,2272,2273,2274,2324,2325,2326,2327,2328,2329,2343,2344,2345,2346,2347,2348,2388,2389,2390,2391,2392,2393,2407,2408,2409,2410,2411,2412,2452,2453,2454,2455,2456,2457,2471,2472,2473,2474,2475,2476,2516,2517,2518,2519,2520,2521,2535,2536,2537,2538,2539,2540,2580,2581,2582,2583,2584,2585,2599,2600,2601,2602,2603,2604,2644,2645,2646,2647,2648,2649,2663,2664,2665,2666,2667,2668,2708,2709,2710,2711,2712,2713,2727,2728,2729,2730,2731,2732,2772,2773,2774,2775,2776,2777,2791,2792,2793,2794,2795,2796,2836,2837,2838,2839,2840,2841,2855,2856,2857,2858,2859,2860],"branch":"reshape","family":"lume-reach","id":"lume-reach-reshape","passable_cell_count":3873,"passable_component_count":1,"sites":[{"id":"local-core","passable":true,"reachable":true,"x":10,"y":10},{"id":"opponent-core","passable":true,"reachable":true,"x":54,"y":54},{"id":"future-well","passable":true,"reachable":true,"x":32,"y":32}]},{"base":"glass-scar-v1","blocked_cell_count":200,"blocked_cell_indices":[1928,1929,1930,1931,1936,1937,1938,1939,1940,1941,1942,1943,1944,1945,1946,1947,1948,1949,1950,1951,1952,1953,1954,1955,1956,1957,1958,1959,1960,1961,1962,1963,1964,1965,1966,1967,1972,1973,1974,1975,1992,1993,1994,1995,2000,2001,2002,2003,2004,2005,2006,2007,2008,2009,2010,2011,2012,2013,2014,2015,2016,2017,2018,2019,2020,2021,2022,2023,2024,2025,2026,2027,2028,2029,2030,2031,2036,2037,2038,2039,2056,2057,2058,2059,2064,2065,2066,2067,2068,2069,2070,2071,2072,2073,2074,2075,2076,2077,2078,2079,2080,2081,2082,2083,2084,2085,2086,2087,2088,2089,2090,2091,2092,2093,2094,2095,2100,2101,2102,2103,2120,2121,2122,2123,2128,2129,2130,2131,2132,2133,2134,2135,2136,2137,2138,2139,2140,2141,2142,2143,2144,2145,2146,2147,2148,2149,2150,2151,2152,2153,2154,2155,2156,2157,2158,2159,2164,2165,2166,2167,2184,2185,2186,2187,2192,2193,2194,2195,2196,2197,2198,2199,2200,2201,2202,2203,2204,2205,2206,2207,2208,2209,2210,2211,2212,2213,2214,2215,2216,2217,2218,2219,2220,2221,2222,2223,2228,2229,2230,2231],"branch":"harvest","family":"seven-accounts","id":"seven-accounts-harvest","passable_cell_count":3896,"passable_component_count":1,"sites":[{"id":"local-core","passable":true,"reachable":true,"x":10,"y":10},{"id":"opponent-core","passable":true,"reachable":true,"x":54,"y":54},{"id":"future-well","passable":false,"reachable":false,"x":32,"y":32}]},{"base":"glass-scar-v1","blocked_cell_count":165,"blocked_cell_indices":[1928,1929,1930,1931,1936,1937,1938,1939,1940,1941,1942,1943,1944,1945,1946,1947,1948,1956,1957,1958,1959,1960,1961,1962,1963,1964,1965,1966,1967,1972,1973,1974,1975,1992,1993,1994,1995,2000,2001,2002,2003,2004,2005,2006,2007,2008,2009,2010,2011,2012,2020,2021,2022,2023,2024,2025,2026,2027,2028,2029,2030,2031,2036,2037,2038,2039,2056,2057,2058,2059,2064,2065,2066,2067,2068,2069,2070,2071,2072,2073,2074,2075,2076,2084,2085,2086,2087,2088,2089,2090,2091,2092,2093,2094,2095,2100,2101,2102,2103,2120,2121,2122,2123,2128,2129,2130,2131,2132,2133,2134,2135,2136,2137,2138,2139,2140,2148,2149,2150,2151,2152,2153,2154,2155,2156,2157,2158,2159,2164,2165,2166,2167,2184,2185,2186,2187,2192,2193,2194,2195,2196,2197,2198,2199,2200,2201,2202,2203,2204,2212,2213,2214,2215,2216,2217,2218,2219,2220,2221,2222,2223,2228,2229,2230,2231],"branch":"preserve","family":"seven-accounts","id":"seven-accounts-preserve","passable_cell_count":3931,"passable_component_count":1,"sites":[{"id":"local-core","passable":true,"reachable":true,"x":10,"y":10},{"id":"opponent-core","passable":true,"reachable":true,"x":54,"y":54},{"id":"future-well","passable":true,"reachable":true,"x":32,"y":32}]},{"base":"glass-scar-v1","blocked_cell_count":145,"blocked_cell_indices":[1928,1929,1930,1931,1936,1937,1938,1939,1940,1941,1942,1943,1944,1945,1946,1958,1959,1960,1961,1962,1963,1964,1965,1966,1967,1972,1973,1974,1975,1992,1993,1994,1995,2000,2001,2002,2003,2004,2005,2006,2007,2008,2009,2010,2022,2023,2024,2025,2026,2027,2028,2029,2030,2031,2036,2037,2038,2039,2056,2057,2058,2059,2064,2065,2066,2067,2068,2069,2070,2071,2072,2073,2074,2086,2087,2088,2089,2090,2091,2092,2093,2094,2095,2100,2101,2102,2103,2120,2121,2122,2123,2128,2129,2130,2131,2132,2133,2134,2135,2136,2137,2138,2150,2151,2152,2153,2154,2155,2156,2157,2158,2159,2164,2165,2166,2167,2184,2185,2186,2187,2192,2193,2194,2195,2196,2197,2198,2199,2200,2201,2202,2214,2215,2216,2217,2218,2219,2220,2221,2222,2223,2228,2229,2230,2231],"branch":"reshape","family":"seven-accounts","id":"seven-accounts-reshape","passable_cell_count":3951,"passable_component_count":1,"sites":[{"id":"local-core","passable":true,"reachable":true,"x":10,"y":10},{"id":"opponent-core","passable":true,"reachable":true,"x":54,"y":54},{"id":"future-well","passable":true,"reachable":true,"x":32,"y":32}]},{"base":"open-grid","blocked_cell_count":282,"blocked_cell_indices":[411,412,413,419,420,421,475,476,477,483,484,485,539,540,541,547,548,549,603,604,605,611,612,613,667,668,669,675,676,677,731,732,733,739,740,741,795,796,797,803,804,805